input	text	baseline_text	method_text	ocr	baseline_dist	method_dist	u	baseline_accuracy	method_accuracy
001.jpg	SNEHA PANDEY TSPDL	SNEHA PANDEY SS TSPDL Foe oe 	SNEHA PANDEY TSPDL 	1	11	1	18	0.3888888888888889	0.9444444444444444
002.jpg	SANTOSH SONAWANE Trig Security Manager	SANTOSH SONAWANE Trig 	SANTOSH SONAW ANE Trig Security Manager 	1	16	2	38	0.5789473684210527	0.9473684210526315
003.jpg	STIAMO RECLUTANDO JETN! Hai voglia di	Hal voglia di 	Hai voglia di 	1	26	25	37	0.2972972972972973	0.32432432432432434
005.jpg	ELEGOO UNO R3 PROJECT Basic Starter Kit	Basic Starter Kit 	UNO RSI Basic Starter Ki 	1	23	17	39	0.41025641025641024	0.5641025641025641
006.jpg	Offerta Lampo Kindle eBook in offerta solo per 24 ore	€Book in offer 	 	1	39	52	53	0.2641509433962264	0.018867924528301886
007.jpg	SanDisk	 	 	1	7	7	7	0.0	0.0
008.jpg	DOUGLAS ADAMS GUIDA GALATTICA per gli AUTOSTOPPISTI il ciclo completo	GALATTICA —pen glii— ev 4 ~ AUTOSTOPPISTI it ciclo completo accra” Se :SsehCUS oO SO 	—— DOUGLASS oaAMS DOUBLAgSADA GUIDA GALATTICA autosTopeisht © Py ae acrirranre Set SA. CUP Sh OS 	1	56	62	69	0.18840579710144928	0.10144927536231885
009.jpg	ABCD	 	 	1	4	4	4	0.0	0.0
010.jpg	Scout CNGEI Siamo un'associazione scout laica, presente a Trento con 2 Gruppi (5 unità) che coinvolgono bambini dagli 8 fino a ragazzi di 19 anni. Abbiamo bisogno di adulti volontari: se hai piacere, per saperne di più, scannerizza il QR code	che coinvolgono bambini dat 8 elalall fino! a ragazzi di 19 anni. Abbiamo bisogno di adulti volontari: se hai | piacere, per saperne di piu, scannerizza il ¢¢~ \ QRcode Sl AU Wisi Soe 	“ne cove: rae < Su? het Abry;: wT wey ~ ae | om 	1	125	213	242	0.4834710743801653	0.11983471074380166
